function_type,function_mysql,description,returns,argument_func_mysql,detailed_description,replacing,examples_mysql,
д/в,TIMESTAMPDIFF(),разница в единицах измерения,ч,"единица измерения (в которой требуется получить разницу),  1 д/в (д), 2 д/в(д)","вычисления разницы между двумя значениями даты и времени в определенных единицах измерения. Если первое д/в, переданное в функцию TIMESTAMPDIFF(), больше второго, функция вернет отрицательный результат.  Каждый из аргументов, передаваемых в функцию TIMESTAMPDIFF(), может быть как датой и временем, так и просто датой, при этом д имеет нулевые значения по всем компонентам времени.",,"SELECT TIMESTAMPDIFF(HOUR, '2023-10-20 07:00:00', '2023-10-20 12:00:00') AS hours     ----  5",
д/в,TIMESTAMP(),обьединение даты и времени,д/в,"д, в","объединения даты и временного значения. Функция TIMESTAMP() автоматически конвертирует каждые 24 часа в 1 день.  Временное значение может не указываться, в таком случае оно будет принято равным 00:00:00.",,"SELECT TIMESTAMP('2023-10-20', '28:00')   ---- 2023-10-21 04:00:00",
д/в,DATE_FORMAT(),форматирования даты и времени,т,"д/в (д), т формата","форматирования даты и времени. в качестве первого аргумента может принимать не только дату и в, но и просто дату. Во втором случае считается, что д имеет нулевые значения по всем компонентам времени.",,"SELECT DATE_FORMAT('2023-10-20 07:30:00', '%H:%i, %d.%m.%Y')    ----   07:30, 20.10.2023",
д/в,TIME_FORMAT(),форматирование времени,т,"временное значение, т формата",форматирование времени,,"SELECT TIME_FORMAT('12:30:00', 'Time: %H:%i')     -----   Time: 12:30",
д/в,STR_TO_DATE(),т в дату,д (+-в),"т с компонентами даты и времени, т формата","Функция извлекает из строки string компоненты даты и времени в соответствии с форматом format и возвращает дату и в на основе извлеченных компонентов. Если в строке с компонентами представлены только компоненты даты, функция STR_TO_DATE() вернет дату без времени, если только компоненты времени — в без даты.  При этом для создания даты или даты и времени должны быть определены все компоненты даты (год, месяц, ч), и если хотя бы один компонент пропущен, функция вернет значение NULL. В случае с временным значением достаточно одного любого компонента, остальные по умолчанию примут значение 0.  Во в использования функции STR_TO_DATE() необходимо следить за тем, чтобы т с компонентами даты и времени полностью соответствовала строке формата, в противном случае функция вернет значение NULL.",,"SELECT STR_TO_DATE('07:30, 20.10.2023', '%H:%i, %d.%m.%Y')     -----    2023-10-20 07:30:00",
д/в,GET_FORMAT(),получение формата,формат,"(type,format) type — тип объекта, для которого требуется т формата (DATE, TIME или DATETIME)       format — непосредственно формат (USA, JIS, ISO или EUR) ","получения определенной строки формата для даты, времени или даты и времени.",,"SELECT GET_FORMAT(DATETIME, 'EUR')    ----   %Y-%m-%d %H.%i.%s",
дополнительные,ISNULL(),проверка на NULL,1 или 0,значение,"принимает в качестве аргумента произвольное значение и возвращает 1, если переданным значением является NULL, или 0 в противном случае.",,"SELECT ISNULL(0)   ---   0,        ISNULL(NULL)       -----    1;",
дополнительные,IF(),условие - 2 значения,значение,"условное выражение, значение1, значение2","используется для выбора одного из двух значений в зависимости от результата некоторого условного выражения. возвращает значение1, если условное выражение истинно, или значение2 в противном случае.",,"SELECT IF(1 > 0, 'bee', 'geek')     ----    bee",
дополнительные,COALESCE(),первый не NULL из списка значений,значение,аргументы ч-з запятую,"поиск первого непустого значения. Она принимает переменное количество аргументов и возвращает первый из них, не равный NULL.",IFNULL,"SELECT COALESCE(1, 2, 3)   ---   1,        COALESCE(NULL, 2, 3)   ---   2,        COALESCE(1, NULL, 3)    ---   1",
дополнительные,IFNULL(),меняет NULL на значение,значение,"исходное проверяемое значение, альтернативное значение","замена некоторого значения на альтернативное, если исходное значение равняется NULL.  возвращает значение value, если оно не равняется NULL, или значение alternative_value в противном случае.",,"SELECT IFNULL(NULL, 'geek')    ----    geek,        IFNULL('bee', 'geek')    ----    bee",
дополнительные,NULLIF(),Сравнивает 2 значения,NULL или значение,"значение1, значение2","сравнение двух значений.  возвращает значение NULL, если значения value1 и value2 совпадают, или значение value1 в противном случае.  ",,"SELECT NULLIF('bee', 'bee')     ----    NULL,        NULLIF('bee', 'geek')    ----    bee",
дополнительные,CONVERT(),конвертация типов данных,значение,"значения (кот нужно преобразовать), тип","Функция приводит значение value к типу type и возвращает полученный результат.  Значение, приводимое к определенному типу, должно соответствовать формату этого типа, в противном случае функция CONVERT() вернет значение NULL.  Однако при попытке привести несоответствующее формату значение к чвому типу функция CONVERT() вернет значение 0.  ",,"SELECT CONVERT(100.78, DECIMAL(4, 1))   ---   100.8,   SELECT CONVERT CONVERT('beegeek', DATE)   ---   NULL,    SELECT CONVERT('beegeek', SIGNED)   ---   0",
дополнительные,CASE…. END,условные конструкции — значения,значение,набор условных конструкций,проверку нескольких условий и в зависимости от истинности одного из них вернуть соответствующее значение.,,"SELECT title, author, UPPER(CASE      WHEN price < 5 THEN 'Cheap'     WHEN price BETWEEN 5 AND 15 THEN 'Regular'     ELSE 'Expensive'     END) AS rate FROM Books;     ORDER BY CASE     WHEN title LIKE 'The %' THEN 1 ELSE 2 END;",
дополнительные,FIELD(),порядковый номер из списка,ч,"поле, аргументы для сравнения ч-з запятую","возвращает индекс одного из аргументов (начиная со второго аргумента, который имеет индекс 1) при совпадении первого аргумента с ним, или 0 при отсутствии совпадений.",,"ORDER BY FIELD(status, 'Basic', 'Bronze', 'Silver', 'Gold') DESC, name",
агрегатные,AVG(),среднее арифметическое ,ч,поле (набор значений),"вычисления среднего арифметического чвых значений поля.  игнорирует значения NULL при вычислении среднего арифметического значений поля. можно использовать ключевое слово DISTINCT, чтобы в итоговых вычислениях участвовали лишь уникальные значения поля. возвращают значение 0.0, если применяются к нечвым полям.",,SELECT AVG(streams) AS avg_streams FROM Songs WHERE release_year >= 2000,
агрегатные,COUNT(),Кол-во записей,ч,* для опр кол-ва записей (поле для опр кол-ва значений),"подсчета количества записей в таблице или количества значений в поле.  Для определения количества значений в поле функции COUNT() в качестве аргумента необходимо передать это поле.  Для определения количества записей в таблице в функцию COUNT() в качестве аргумента необходимо передать звездочку (*).    Важным отличием между вызовами COUNT(*) и COUNT(<название поля>) является то, что в первом случае возвращается количество записей в таблице без учета значений в этих записях, в то в как во втором случае возвращается количество значений в поле, причем значения NULL не учитываются.  можно использовать ключевое слово DISTINCT, чтобы в итоговых вычислениях участвовали лишь уникальные значения поля  ",,"SELECT COUNT(*) AS num_of_songs,        COUNT(release_year) AS num_of_years FROM Songs;",
агрегатные,MIN(),минимальное значение,значение,поле,поиска минимального значений в поле. игнорируют значения NULL при вычислении. применяется и к строковым полям.,,,
агрегатные,MAX(),максимальное значение,значение,поле,поиска ммаксимального значений в поле. игнорируют значения NULL при вычислении. применяется и к строковым полям.,,,
агрегатные,SUM(),сумма,ч,поле,"вычисления суммы чвых значений поля.  игнорирует значения NULL.  можно использовать ключевое слово DISTINCT, чтобы в итоговых вычислениях участвовали лишь уникальные значения поля. возвращают значение 0.0, если применяются к нечвым полям.",,"SELECT SUM(WEEKDAY(submit_date) BETWEEN 5 AND 6) AS weekend_count,",
агрегатные,GROUP_CONCAT(trackname SEPARATOR ', '),перечисления значений поля,значения,поле,"перечисления значений поля через запятую. Перечисляемые функцией GROUP_CONCAT() значения можно сортировать.  Запятая является разделителем по умолчанию, и его можно изменить. Чтобы задать собственный разделитель, необходимо воспользоваться ключевым словом SEPARATOR, после которого предоставить строку, содержащую разделитель. игнорирует значения NULL.  можно использовать ключевое слово DISTINCT, чтобы в итоговых вычислениях участвовали лишь уникальные значения поля",,       
оконные,ROW_NUMBER(),порядковый номер записи в рамках указанного окна (начиная с 1),,,"вычисляет порядковый номер записи в рамках указанного окна (начиная с 1). ORDER BY в спецификации окна определяет порядок записей лишь внутри окна.  Секционирование выполняется с помощью оператора PARTITION BY. Если нужно секционирование и упорядочивание, то оператор PARTITION BY должен располагаться до оператора ORDER BY",,ROW_NUMBER() OVER (PARTITION BY department ORDER BY salary DESC) AS row_num,
оконные,DENSE_RANK(),ранг записи в рамках указанного окна.,,,"вычисляет ранг записи в рамках указанного окна. Функция присваивает первой записи окна ранг, равный 1, и увеличивает его каждый раз, когда очередная запись в поле (или полях) упорядочивания содержит значение, отличное от значения предыдущей записи в том же поле.",,DENSE_RANK() OVER (PARTITION BY department ORDER BY salary DESC) AS place,
оконные,RANK(),ранг записи в рамках указанного окна с пропуском при повторении,,,"выполняет ранжирование в рамках указанного окна, при повторении рангов следующий ранг отбрасывает.",,,
оконные,NTILE(),разбивает на группы,,Кол-во групп,"разбиения окна на заданное количество групп равного размера. если окно из n записей делится на k групп, то первые n % k (остаток от деления n на k) групп будут содержать ровно на 1 запись больше, чем остальные группы.",,NTILE(3) OVER (ORDER BY id) AS group_number,
оконные,AVG(),среднее арифметическое ,,поле,"среднее арифметическое чвых значений, хранящихся в определенном поле окна. игнорируют значения NULL. возвращают значение 0.0, если применяются к нечвым полям.",,AVG(salary) OVER (PARTITION BY department) AS department_avg_salary,
оконные,SUM(),сумма,,поле,"Вычисляет сумму чвых значений, хранящихся в определенном поле окна. игнорируют значения NULL. возвращают значение 0.0, если применяются к нечвым полям.",,"SUM(salary) OVER () AS sum_salary, SUM(salary) OVER (PARTITION BY department) AS department_sum_salary",
оконные,COUNT(),подсчет записей,,поле или *,"подсчета записей или непустых значений в поле. Если ее аргументом является звездочка (*), функция вычисляет количество записей в окне, если название поля — количество непустых значений в этом поле окна.",,"COUNT(*) OVER (PARTITION BY department) AS employess_in_department, COUNT(salary) OVER (PARTITION BY department) AS employess_in_department_with_salary",
оконные,MIN(),минимум,,поле,"вычисляет минимальное значение, хранящиеся в определенном поле окна, игнорируют значения NULL",,MIN(salary) OVER (PARTITION BY department) AS department_min_salary,
оконные,MAX(),максимум,,поле,"вычисляет максимальное значение, хранящиеся в определенном поле окна, игнорируют значения NULL",,MAX(salary) OVER (PARTITION BY department) AS department_max_salary,
оконные,FIRST_VALUE(),значение первой записи окна,,поле,"получения значения, которое содержится в определенном поле первой записи окна. Исп только с упорядоченными окнами.",,FIRST_VALUE(salary) OVER (ORDER BY id) AS first_employee_salary,
оконные,LAST_VALUE(),значение последней записи окна,,поле,"получения значения, которое содержится в определенном поле последней записи окна. Если границы не определены то окно - от самой первой записи до текущей. Исп только с упорядоченными окнами.",,LAST_VALUE(salary) OVER (ORDER BY id ROWS BETWEEN UNBOUNDED PRECEDING AND UNBOUNDED FOLLOWING) AS last_employee_salary,
оконные,NTH_VALUE(),значение n-ой записи окна,,"поле, номер записи","получения значения, которое содержится в определенном поле n-ой записи окна (начиная с 1).  Важно определение границ. Исп только с упорядоченными окнами. возвращает значение NULL если выходит за рамки",,,
оконные,LAG(),значения отстающей от текущей на n,,"поле, номер записи, значение если функция выходит за рамки окна","получения значения, которое содержится в определенном поле записи окна, отстающей от текущей на n. Возвращает значение NULL, если пытается получить значение записи, выходящей за рамки окна. В случае выхода за рамки окна функция LAG() умеет возвращать не только NULL, но и любое другое значение. Для этого при вызове функции достаточно указать необходимое значение в качестве третьего аргумента. Полностью игнорирует границы окна. Используется только с упорядоченными окнами.",,"LAG(salary, 1, 0) OVER (ORDER BY id) AS prev_employee_salary",
оконные,LEAD(),значения опережающей текущую на n.,,"поле, номер записи, значение если функция выходит за рамки окна","получения значения, которое содержится в определенном поле записи окна, опережающей текущую на n. Полностью игнорирует границы окна. Используется только с упорядоченными окнами.  ",,"LEAD(salary, 1, 0) OVER (ORDER BY id) AS next_employee_salary",
